id1,id,SL,week,year,state,city,disctrict,cases,death,st_date,end_date,description,location,lat,lon
274,851,851,9,2019,Maharashtra,Kolhapur,Kolhapur,7,1,27-02-2019 00:00,03-01-2019 00:00,"Cases reported from Village Sita Colony (Dasara Chowk) and Subhash Nagar, Kolhapur Municipal Corporation.    District    RRT    investigated    the outbreak.     House     to     house     survey     done. Entomological  indices  were  HI-16.94,  BI-22.03, CI.-12.14.  07  blood  samples  taken  and  found positive  for  Dengue  by  IgM  ELISA  at  SSH, CPRH,    Kolhapur.    Health    Education    given. Personal       protection       and       environmental management   of   mosquitoes.   All   cases   treated symptomatically.    Source    reduction    activities undertaken. Death details : 45 years old male died
due to dengue"," Sita Colony (Dasara Chowk) and Subhash Nagar, Kolhapur Municipal Corporation",16.6985376,74.2239462
275,978,978,23,2019,Maharashtra,Palaghar,Ratnagiri,8,0,24-05-2019 00:00,,"Cases  reported  from Village  Chaudhari  pada,  Bauddhawadi, SC   Khupri,    PHC   Kudus,   Block   Wada.   District   RRT investigated the outbreak.  Larval breeding observed in water storage tank in the village. 9 samples tested out of which 5 were NS1 ELISA positive & 2 IgM ELISA positive. House to house monitoring  done,  container  survey  done.  All  cases  treated symptomatically.   Source   reduction   activities   undertaken.
Health education given.","  Chaudhari  pada,  Bauddhawadi, SC   Khupri,    PHC   Kudus,   Block   Wada",19.5333783,73.1001081
276,979,979,23,2019,Maharashtra,Raigarh,Raigarh,24,0,20-05-2019 00:00,,"Cases   reported   from   JSW   Company   Tata   Project,   L&T Company  Wadkhal,  L&T  Company  Kharpale,  SC  Bori  & Dolvi, PHC Gadab, Taluka Pen. District RRT investigated the outbreak. Non Cleanliness in company premises was leading to mosquito breeding. Entomological survey done HI - 20.0, BI - 33.0, CI - 13.0. 4 Sample Sent to JJ Hospital and all 4 found positive for Dengue by IgM ELISA. 13 Blood Sample Tested for  Malaria  and  Found  Negative.  Fogging  done.  All  cases treated     symptomatically.     Source     reduction     activities
undertaken. Health education given.","JSW   Company   Tata   Project,   L&T Company  Wadkhal,  L&T  Company  Kharpale,  SC  Bori  & Dolvi, PHC Gadab, Taluka Pen",18.6972429,73.0342709
277,999,999,24,2019,Maharashtra,Sangli,Sangli,12,0,29-05-2019 00:00,,"Cases reported  from Village Gavan,  PHC  Manerajuri, Block Tasgaon.  District  RRT  investigated  the  outbreak.  Out  of  5 blood sample collected and sent to General Medical College, Miraj; 5 samples were found positive Dengue (IgM ELISA). All cases treated symptomatically. Entomological survey done.
Source reduction activities undertaken. Health education given."," Gavan,  PHC  Manerajuri, Block Tasgaon",17.0268217,74.6986158
278,1018,1018,25,2019,Maharashtra,Kolhapur,Kolhapur,7,0,15-06-2019 00:00,,"Cases  reported  from  (Tipugade  and  Nikam  galli)  Kalamba, SC  Kalamba,  PHC  Kaneri,  Block  Karveer.  District  RRT investigated   the   outbreak.   Entomological   indices   are   HI:
16.86 %, CI: 8.90 %, BI: 20.48 %. 8 Blood Serum taken out of  which  5  are  positive  for  Dengue  by  IgM  ELISA  at  SSH CPRH Kohlapur. House to house survey done. Pit holes were
filled.   Breeding   places   were   destroyed.   Fogging   done. Personal protective measures recommended.","Tipugade  and  Nikam  galli,  Kalamba, SC  Kalamba,  PHC  Kaneri,  Block  Karveer",16.6625063,74.2096799
279,1019,1019,25,2019,Maharashtra,Satara,Satara,6,0,28-05-2019 00:00,,"Cases  reported  from  Village  Varade,  SC  Belawade,  PHC Umbraj, Block Karad. District RRT investigated the outbreak. House  to  house  fever  survey  done.  Water  collections  were dried   or   emptied.   People   were   advised   to   cover   water collected  for  domestic  purposes.  Increase  in  larval  density found. 6 Blood samples taken and sent to Civil hospital Satara
out  of  which  5  found  positive  for  Dengue  by  IgM  ELISA. Fogging done.","  Varade,  SC  Belawade,  PHC Umbraj, Block Karad",17.4013008,74.099118
280,1035,1035,26,2019,Maharashtra,Raigarh,Raigarh,15,0,26-06-2019 00:00,28-06-2019 00:00,"Cases reported from Karambeli,  SC Usroli, PHC Wavoshi,     Block     Khalapur.     District     RRT investigated the outbreak. House to house survey done.  Out  of  10  serum  samples  sent  to  DPHL Raigad;   5   samples   were   found   positive   for Dengue    (IgM    ELISA).    All    cases    treated
symptomatically.  Fogging  and  source  reduction activities undertaken. Health education given.","Karambeli,  SC Usroli, PHC Wavoshi,     Block     Khalapur",18.8303574,73.2866809
281,1060,1060,28,2019,Maharashtra,Thane,Thane,5,1,07-01-2019 00:00,,"Cases reported from Village Vartak Nagar,  Thane Municipal Corporation. District RRT investigated the outbreak. House to house survey done.  5 blood samples collected; result awaited. All cases treated symptomatically. Entomological survey done
(H.I. - 14.6, C.I. - 7.3, B.I.  14). Fogging and source reduction activities undertaken. Health education given."," Vartak Nagar,  Thane Municipal Corporation",19.2083711,72.9601638
282,1082,1082,29,2019,Maharashtra,Satara,Satara,28,0,06-03-2019 00:00,,"Cases  reported   from  Block   Khatav,   Block  Satara,   Block Karad.  District  RRT   investigated  the  outbreak.  21  blood serum  samples  collected  and  sent  to  Civil  Hospital  and  15 found positive for Dengue by IgM ELISA. All cases treated. Active fever surveillance done in the area. IEC done for using personal  protective  methods  against  mosquito  bite.  Fogging done.","Block   Khatav,   Block  Satara,   Block Karad",17.6102951,74.3910019
283,1083,1083,29,2019,Maharashtra,Thane,Thane,5,1,28-06-2019 00:00,,"Cases   reported   from   Ulhasnagar   Corporation   from   UHC Shantinagar.  Increase  larval  density  found  in  the  area.  A  18 year old male died of illness while admitted at Sion hospital Mumbai. 04 blood samples tested for Dengue found negative at UHC Ulhas Nagar 4, 02 blood samples collected and sent to JJ Hospital Thane result awaited. Fogging done.","Ulhasnagar   Corporation, UHC Shantinagar",19.2313442,73.1561657
284,1188,1188,34,2019,Maharashtra,Satara,Satara,15,0,08-10-2019 00:00,,"Cases  reported  from  Village  Deur,  SC  Perle,  PHC  Palashi, Block  Koregaon.  District  RRT   investigated  the  outbreak. House  to  house  survey  done.  Out  of  15  serum  samples collected; 9 samples were positive for Dengue (IgM ELISA). All cases treated symptomatically. Entomological survey done. Source reduction activity and fogging done in the affected area.
Health education given.","  Deur,  SC  Perle,  PHC  Palashi, Block  Koregaon",17.8270275,74.113225
285,1212,1212,35,2019,Maharashtra,Ahmednagar,Ahmednagar,40,0,26-08-2019 00:00,29-08-2019 00:00,"Cases reported from Nagardevale, PHC Devgaon, Block   Nagar.   District   RRT   investigated   the outbreak. A total of 11 blood smears collected and all were found negative for Plasmodium vivax and falciparum and 15 serum samples were collected and     tested   at   sentinel   centre,   Civil   hospital, Ahmednagar 06 samples were found positive for Dengue  by  IgM  ELISA.  All  cases  were  treated symptomatically.   Entomological   survey   done. Fever    survey    done.    Fogging    done.    Health
education given.","Nagardevale, PHC Devgaon, Block   Nagar",19.1084298,74.7353627
286,1221,1221,35,2019,Maharashtra,Ahmednagar,Ahmednagar,32,0,20-08-2019 00:00,,"Cases  reported  from  Pargaon  Sudrik  (Gavthan),  PHC  Loni Venkanath,  Block  Shrigonda.  District  RRT  investigated  the outbreak. A total of 23 blood samples were collected and tested at sentinel center, Civil hospital, Ahmednagar, were negative for  Plasmodium  vivax  and  falciparum.  A  total  of  06  serum samples  were  collected  and  03  were  positive  for  Dengue  by IgM    ELISA.    All   cases    were    treated    symptomatically. Entomological survey revealed of the 652 containers examined 35 were positive for larva, of these in 18 containers Abet was poured and the remaining 17 were emptied. Fever survey done.
Fogging done. Health education given.","Pargaon  Sudrik  (Gavthan),  PHC  Loni Venkanath,  Block  Shrigonda",18.6737001,74.6534311
287,1213,1213,35,2019,Maharashtra,Kolhapur,Kolhapur,5,1,25-08-2019 00:00,31-08-2019 00:00,"Cases     reported     from     Ichalkaranji,     Block Hatkanagle, District   RRT   investigated   the   outbreak.   The affected   area   is   an   industrial   area   with   high migrated   population,   04-05   containers   found positive.   Entomological   survey   revealed   HI- 15.90%, CI-8.19% and BI 22.72%. A total of 04 blood   samples   collected   and   sent   to   Sentinel Surveillance Hospital, CPRH and all were found negative  for  Dengue.  The  deceased  was  positive for Dengue, tested in a private lab.  All cases were treated       symptomatically.       Fogging       done. Environmental interventions for mosquito control undertaken.  Health education given."," Ichalkaranji, Block Hatkanagle",16.7477999,74.4215052
288,1214,1214,35,2019,Maharashtra,Nagpur,Nagpur,23,1,28-08-2019 00:00,31-08-2019 00:00,"Cases   reported   from   Yadav   Nagar   Kampthi. District  RRT  investigated  the  outbreak.  5  blood samples collected and were positive for Dengue by NS1.   All  cases   were  treated   symptomatically.
Health education given.",Yadav   Nagar   Kampthi,21.2113343,79.1922377
289,1222,1222,35,2019,Maharashtra,Palaghar,Ratnagiri,143,0,08-11-2019 00:00,,"Cases reported from Village Kundachapada, SC Bhovadi, PHC Ase, Block Mokhada. District RRT investigated the outbreak. Case   was   suffering   from   Acute   Encephalitis   Syndrome, bodyache  and  generalized  weakness.  A  total  of  22  samples were  collected  and  10  were  positive  for  Dengue  by  IgM ELISA. All cases were treated symptomatically. Rapid house to  house  survey  and  container  survey  done.  Fogging  done.
Health education given."," Kundachapada, SC Bhovadi, PHC Ase, Block Mokhada",19.9364773,73.3403498
290,1251,1251,36,2019,Maharashtra,Satara,Satara,6,0,30-07-2019 00:00,30-07-2019 00:00,"Cases  reported  from  Village  Targaon,  SC  Targaon,  PHC Vathar  ki,  Block  Koregaon.  District  RRT  investigated  the outbreak. Active search of cases done in the affected area. Out of  6  serum  samples  collected  and  sent  to  Civil  Hospital Satara, 4 samples were positive for Dengue (IgM ELISA). All cases  treated  symptomatically.  Entomological  survey  done.
Source  reduction  activity  and  fogging  done  in  the  affected area. Health education given.","  Targaon,  SC  Targaon,  PHC Vathar  ki,  Block  Koregaon",17.6937993,74.1684413
291,1252,1252,36,2019,Maharashtra,Thane,Thane,61,0,20-07-2019 00:00,20-07-2019 00:00,"Cases reported from several areas of Municipal Corporation. District   RRT   investigated   the   outbreak.   House   to   house survey done. 35 serum samples collected; result awaited. All the  2  blood  samples  collected  and  sent  to  NIV,  Pune  were positive  for  Dengue  (IgM  ELISA).   4  deaths  occurred  in  2 male  (19yr  &17yr)  and  2  female  (21yr  &  4yr)  All  cases treated  symptomatically. Entomological  survey done. Source
reduction  activity  and  fogging  done  in  the  affected  area. Health education given.",Municipal Corporation,19.1976747,72.9671406
292,1253,1253,36,2019,Maharashtra,Thane,Thane,4,0,16-08-2019 00:00,16-08-2019 00:00,"Cases  reported   from  Village  Cherpoli,  SC   Atgaon,   PHC Aghai,   Taluk   Shahapur.   District   RRT   investigated   the outbreak. House to house survey done. All 4  serum samples collected and sent to Sentinel Centre Thane; were positive for Dengue   (IgM   ELISA).   One   death   occurred   in   45yr   old female.  All  cases  treated  symptomatically.  Source  reduction
activity and fogging done in the affected area. Entomological survey done. Health education given.","  Cherpoli,  SC   Atgaon,   PHC Aghai,   Taluk   Shahapur",19.4539261,73.3276543
293,1277,1277,37,2019,Maharashtra,Aurangabad,Aurangabad,53,1,09-03-2019 00:00,,"Cases reported from Shastrinagar, PHC SDH Vaijapur, Block Vaijapur.   District   RRT   investigated   the   outbreak.   The deceased was a 21 year old male. Scattering of cases was seen in  areas  where  mosquito  density  raised,  HI  12.44%,  BI- 12.44%  Ades  density  3.2%.  A  total  of  53  blood  samples collected,  07  serum  samples  collected  and  sent  to  GMC Aurangabad,    result    awaited.    All    cases    were    treated symptomatically. House to house survey conducted. Fogging done.    Source    reduction    activities    undertaken.    Health
education given.","Shastrinagar, PHC SDH Vaijapur, Block Vaijapur",19.9256818,74.7284812
294,1275,1275,37,2019,Maharashtra,Parbhani,Parbhani,32,1,09-07-2019 00:00,09-12-2019 00:00,"Cases  reported  from  Village  Pimpla,  SC  Palodi, PHC    Kolha,    Block    Manwat.    District    RRT investigated  the  outbreak.  The  deceased  was  a  9 year old boy and  had  tested  positive  for Dengue NS1.  A  total  of  18  blood  smears  were  collected and all found negative for malaria. A total of 16 serum samples were collected and tested at GMC Nanded  and  03  samples  were  found  positive  for Dengue  by  IgM  ELISA.  All  cases  were  treated symptomatically.   House   to   house   survey   and
larval  survey  conducted.  Fogging  done  Health education given.","  Pimpla,  SC  Palodi, PHC    Kolha,    Block    Manwat",19.2925914,76.4978437
295,1276,1276,37,2019,Maharashtra,Sindhudurg (Kudal),Sindhudurg,8,0,09-05-2019 00:00,09-11-2019 00:00,"Cases  reported  from  Village/SC/PHC  Kasarde, Block  Kankavli.  District  RRT  investigated  the outbreak. A total of 08 samples were collected for Malaria; all were negative for Malaria. A total of 04  samples  were  collected  and  tested  at  NIV, Pune;   02   were   positive   for   Dengue   by   IgM ELISA.  All  cases  were  treated  symptomatically. House  to  house  survey  conducted.     Mosquito control    measures    undertaken.    Entomological indices   are   CI   3.4,   HI   9.8,   BI   13.1.   Health
education given.","  Kasarde, Block  Kankavli",16.4334135,73.6737109
296,1278,1278,37,2019,Maharashtra,Thane,Thane,6,1,30-08-2019 00:00,,"Cases   reported   from   Ramchandra   Nagar   No.   30,   UHC Kajuwadi, Thane Municipal  Corp. District RRT  investigated the outbreak. The deceased was a 24 year old male who tested positive for Dengue by IgM. A total of 05 blood samples were collected and tested at Jupiter Lab Thane; all were negative. Container  surveillance  and  fever  surveillance  done.  Fogging done. Health education given.","Ramchandra   Nagar   No.   30,   UHC Kajuwadi, Thane Municipal  Corp",19.2190978,72.9676688
297,1301,1301,38,2019,Maharashtra,Jalna,Jalna,9,1,09-06-2019 00:00,,"Cases  reported  from  PHC  Karla,  Block  Jalna.  District  RRT investigated the outbreak. State and District NVBDCP officials were informed. House to house survey conducted. A total of 09 samples  were  collected  and  tested  at  GMC,  Aurangabad;  02 were positive for Dengue by IgM. The deceased was a 69 year
old    female.    Fogging    done.    All    cases    were    treated symptomatically. Health education given.","PHC Karla, Block Jalna",19.8490946,75.9054844
298,1302,1302,38,2019,Maharashtra,Satara,Satara,26,0,27-08-2019 00:00,,"Cases reported from Village/SC Nidhal, PHC Pusegaon, Block Satara.  District  RRT  investigated  the  outbreak.  State  and District NVBDCP officials were informed. Active fever survey done. A total of 03 blood samples sent to Civil Hospital Satara and were positive for Dengue by IgM ELISA. Fogging Done.
All  cases  were  treated  symptomatically.  Health  education given."," Nidhal, PHC Pusegaon, Block Satara",17.7081641,74.3206208
299,1329,1329,39,2019,Maharashtra,Ahmednagar,Ahmednagar,20,0,25-09-2019 00:00,27-09-2019 00:00,"Cases  reported  from  Shirasgaon,  PHC  Nimgaon Khaire,     Block     Shrirampur.     District     RRT investigated   the   outbreak.   State   and   District NVBDCP  officials  were informed.  A total of 13 blood  samples  collected  and  tested  at  SSH(Civil hospital,   Ahmednagar);   12   were   positive   for
Dengue  by  IgM  ELISA.  All  cases  were  treated symptomatically. Health education given.","Shirasgaon,  PHC  Nimgaon Khaire",19.6831116,74.6558708
300,1330,1330,39,2019,Maharashtra,Nandurbar,Nandurbar,26,2,21-09-2019 00:00,25-09-2019 00:00,"Cases   reported   from  Block   Navapur,   (Shasari Nagar).  District  RRT  investigated  the  outbreak. State    and    District    NVBDCP    officials    were informed. Fever survey done. A total of 03 serum samples collected and 02 were positive. All cases were    treated    symptomatically.    Entomological survey done. Health education given.","Block   Navapur,   (Shasari Nagar)",21.115612,73.83743
301,1333,1333,39,2019,Maharashtra,Pune,Pune,44,0,09-01-2019 00:00,,"Cases reported from Villages Nira, Vasti, Purandar, SC Nira, Shelgaon,   Saswad,   Saswad   Urban,   PHC   Nira,   Bijawdi, Malshiras, Malshirass. District RRT investigated the outbreak. State and District NVBDCP officials were informed. House to house survey done.  A total of 52 samples collected and tested at  NIV  Pune  and  24  samples  were  positive  for  Dengue.  All cases were treated symptomatically. Anti-larval activities were undertaken in the affected area. Fogging done in the affected
area. Health education given.","s Nira, Vasti, Purandar, SC Nira, Shelgaon,   Saswad,   Saswad   Urban,   PHC   Nira,   Bijawdi, Malshiras, Malshirass",17.8613781,74.9001698
302,1369,1369,40,2019,Maharashtra,Amravati,Amravati,4,0,25-09-2019 00:00,,"Cases  reported  from Village  Saidapur, PHC Kokarda, Block Anjangaon Surji. District RRT investigated the outbreak. State and District NVBDCP officials were informed. House to house survey  done.  Out  of  4  serum  samples  collected  and  sent  to DPHL  Akola; 3  samples  were positive  for both Dengue and Chikungunya      (IgM      ELISA).      All      cases      treated
symptomatically.   Source   reduction   activities   undertaken. Health education given.","  Saidapur, PHC Kokarda, Block Anjangaon Surji",21.0302723,77.3720992
303,1360,1360,40,2019,Maharashtra,Jalgaon,Jalgaon,42,1,27-09-2019 00:00,10-03-2019 00:00,"Cases  reported  from Village  Kurhe  Panache,  SC Kurhe, PHC Varadsim, Block Bhusawal. District RRT investigated the outbreak. State and District NVBDCP officials were informed. House to house survey  done.  All  4  serum  samples  collected  and sent   to   GMC   Aurangabad;   were   positive   for Dengue    (IgM    ELISA).    All    cases    treated symptomatically.   Entomological   survey   done. Fogging   activity   carried   out   in   affected   area.
Source   reduction   activities   undertaken.   Health education given.","  Kurhe  Panache,  SC Kurhe, PHC Varadsim, Block Bhusawal",20.9625175,75.6873353
304,1361,1361,40,2019,Maharashtra,Nandurbar,Nandurbar,26,0,30-09-2019 00:00,10-03-2019 00:00,"Cases   reported   from   Village   Mentalav,   PHC Umraan,      Block      Navapur.      District      RRT investigated   the   outbreak.   State   and   District NVBDCP officials were informed. House to house survey done.  Out  of  26  serum  samples  collected Civil   Hospital;   2   samples   were   positive   for Dengue.    All    cases    treated    symptomatically. Entomological   survey   done.   Fogging   activity
carried  out  in  affected  area.  Source  reduction activities undertaken. Health education given.","   Mentalav,   PHC Umraan, Block Navapur",21.2047268,73.8574687
305,1370,1370,40,2019,Maharashtra,Pune,Pune,82,0,08-03-2019 00:00,,"Cases reported from several areas in Block Haveli, Linikarbhor Manjri, Keshavnagar. District RRT investigated the outbreak. State and District NVBDCP officials were informed. House to house survey done.14 serum samples, were positive for Dengue (IgM   ELISA)   tested   at   NIV   Pune.      All   cases   treated symptomatically.   Source   reduction   activities   undertaken.
Health education given.","Block Haveli, Linikarbhor Manjri, Keshavnagar",18.5339815,73.9505407
306,1396,1396,41,2019,Maharashtra,Pune,Pune,2,0,08-08-2019 00:00,,"Cases reported from Village Khamgaon Chhatra, SC Ranjane, PHC  Karanjawane,  Block  Velhe.  District  RRT  investigated the outbreak. House to house survey conducted. A total of 04 serum  samples  collected  and  sent  to  NIV,  Pune  and  02 samples were positive for Dengue by IgM ELISA. All cases were  treated  symptomatically.  Health  education  given.  State
and District NVBDCP officials informed.","Khamgaon Chhatra, SC Ranjane, PHC  Karanjawane",20.7131695,76.5650829
307,1397,1397,41,2019,Maharashtra,Sangli,Sangli,33,2,13-09-2019 00:00,,"Cases    reported    from    Village    Borgaon,    Shegaon,    Sni, Manerajuri,  SC  Borgaon,  Shegaon,  Soni,  Manerajuri,  PHC Borgaon,  Shegaon,  Bhose,  Manerajuri,  Block  Walwa,  Jath, Miraj, Tasgaon. District RRT investigated the outbreak. State and    District    NVBDCP    officials    informed.    Daily    case surveillance  and  container  survey  being  carried  out.   The deceased   were  23y/F  and   11y/F.   A  total  of  17  samples collected  and  tested  at  Sentinel  Laboratory  Govt  Medical College Miraj; 11 were positive for Dengue by IgM ELISA. All  cases  were  treated  symptomatically.  Fogging  done,  Anti adult  and  larval  measures  undertaken.  Weekly  once  dry day
being followed. Health education given.","    Borgaon,    Shegaon,    Sni, Manerajuri,  SC  Borgaon,  Shegaon,  Soni,  Manerajuri,  PHC Borgaon,  Shegaon,  Bhose,  Manerajuri,  Block  Walwa,  Jath, Miraj, Tasgaon",17.0230869,74.699798
308,1413,1413,42,2019,Maharashtra,Ahmednagar,Ahmednagar,27,1,10-12-2019 00:00,17-10-2019 00:00,"Cases   reported   from   Village   Kolewadi,   SC Mhaisagaon, PHC Taklimiya Rahuri Ahmednagar. District  RRT  investigate  the  outbreak.  State  and District NVBDCP officials were informed. House to house survey done. 8 blood samples collected. All cases treated symptomatically. Entomological survey     done.     Source     reduction     activities
undertaken. Health education given.","   Kolewadi,   SC Mhaisagaon, PHC Taklimiya Rahuri Ahmednagar",19.3944328,74.4489593
309,1416,1416,42,2019,Maharashtra,Latur,Latur,28,0,15-07-2019 00:00,15-07-2019 00:00,"Cases reported from Village Somnathpur, SC Dongarshelaki, PHC Wadwana (Bu), Block Udgir. District RRT investigated the outbreak. District RRT investigated the outbreak. State and District  NVBDCP  officials  were  informed.  House  to  house survey  done.  9  blood  samples  collected  were  positive  for
Dengue  (IgM  ELISA).  All  cases  treated  symptomatically. Source reduction activities undertaken. Health education given."," Somnathpur, SC Dongarshelaki, PHC Wadwana (Bu), Block Udgir",18.40637,77.1011107
310,1417,1417,42,2019,Maharashtra,Latur,Latur,9,0,09-03-2019 00:00,09-03-2019 00:00,"Cases reported from Village Mulaki, SC Telgaon, PHC Shirur Tajband, Block Udgir. District RRT investigated the outbreak. District  RRT  investigated  the  outbreak.  State  and  District NVBDCP  officials  were  informed.  House  to  house  survey done. Out of 9 blood samples collected; 7 samples were found positive   for   Dengue   (IgM   ELISA).    All   cases   treated symptomatically.   Source   reduction   activities   undertaken.
Health education given."," Mulaki, SC Telgaon, PHC Shirur Tajband, Block Udgir",18.3908961,77.1233049
311,1435,1435,43,2019,Maharashtra,Jalgaon,Jalgaon,26,1,14-10-2019 00:00,,"Cases  reported  from  PHC  Girad,  Block  Bhadgaon.  District RRT  investigated  the  outbreak.  State  and  district  NVBDCP officials informed. House to house and container survey done. The deceased was a 22y/F.  A total of 25 blood smear samples collected and all were negative for Malaria. A total of 07 blood samples  sent  to  GMC  Aurangabad,  02  were  positive  for Dengue    by    IgM     ELISA.     All     cases     were    treated symptomatically.   Source   reduction   activities   carried   out.
Health education given.","PHC  Girad,  Block  Bhadgaon",20.5710903,75.1391336
312,1437,1437,43,2019,Maharashtra,Sholapur,Sholapur,10,0,14-10-2019 00:00,,"Cases reported from Village Vitthalwadi, SC Jinti, PHC Korti, Block Karmala. District RRT investigated the outbreak. State and District  NVBDCP officials were informed. Fever survey and container survey conducted in the affected area. A total of 04 blood samples collected and tested at NIV Pune; 02 were
positive  for  Dengue  by  IgM  ELISA.  All  cases  were  treated symptomatically. Fogging done. Health education given."," Vitthalwadi, SC Jinti, PHC Korti, Block Karmala",18.4014221,75.1936269
313,1465,1465,44,2019,Maharashtra,Buldhana,Buldhana,98,0,24-10-2019 00:00,11-02-2019 00:00,"Cases reported from Buldhana, Padail, Dahil BK. Deopur.  District  RRT  investigate  the  outbreak. State    and    District    NVBDCP    officials    were informed. House to house survey done. All cases treated   symptomatically.   Entomological   survey done.   Source   reduction   activities   undertaken.
Health education given.","Buldhana, Padail, Dahil BK. Deopur",20.4984287,76.0620886
314,1471,1471,44,2019,Maharashtra,Thane,Thane,25,0,09-10-2019 00:00,,"Cases reported  from Koravale, SC Vidhe, PHC Tulai, Taluk Murbad.  District  RRT  investigate  the  outbreak.  State  and District  NVBDCP  officials  were  informed.  House  to  house survey  done.  5  blood  samples  collected;  were  positive  for Dengue  (IgM  ELISA).  All  cases  treated  symptomatically.
Entomological   survey   done.   Source   reduction   activities undertaken. Health education given.","Koravale, SC Vidhe, PHC Tulai, Taluk Murbad",19.2695612,73.4562324
